{
  "schemaVersion": "fence-grant.opsweave.io/v1",
  "grantId": "aaaaaaaa-aaaa-4aaa-8aaa-aaaaaaaaaaaa",
  "jobId": "11111111-1111-4111-8111-111111111111",
  "leaseId": "22222222-2222-4222-8222-222222222222",
  "fencingSequence": 7,
  "sinkScope": "dataset:host-metrics:revision:1",
  "issuedAt": "2026-10-23T00:00:01Z",
  "expiresAt": "2026-10-23T00:05:01Z",
  "keyId": "kernel-fence-key-1",
  "signature": "example-ed25519-signature-not-for-production"
}
